{
  "task_id": "train1.MyCoin_e9b4bf15",
  "file": "/app/contracts/MyCoin.sol",
  "contracts_count": 1,
  "stages": ["phase1", "phase2", "phase3"],
  "results": {
    "compile_result": {
      "status": "success",
      "solc_version": "0.8.20"
    },
    "deploy_result": {
      "status": "fail",
      "error": "gas_limit_exceeded"
    },
    "risk_prefilter": {
      "level": "high",
      "label": 1
    },
    "interactions_digest": {
      "selectors": ["0x095ea7b3"],
      "fail_ratio": 0.12,
      "tx_count": 50
    },
    "present_metrics": {
      "ethereum": {
        "daily_tx": 10000,
        "gas_avg_gwei": 15
      }
    },
    "security_notes": [
      "失败交易比例偏高",
      "关注高频函数选择器的风险"
    ],
    "actions": ["compile_check", "deploy_testnet", "risk_prefilter_cpu"],
    "multi_verification": [
      {
        "combo": "compile_success + deploy_fail",
        "result": "需要创新验证逻辑",
        "innovation": "为[部署失败]生成新的验证逻辑"
      },
      {
        "combo": "deploy_fail + risk_high",
        "result": "风险确认 -> 创新探索",
        "innovation": "为[高风险合约]生成新的路径"
      }
    ]
  },
  "reasoning_input": "完成任务 train1.MyCoin_e9b4bf15",
  "reasoning_output": "起始: 完成任务 train1.MyCoin_e9b4bf15 -> 最终答案: 未达成",
  "timestamp": 1737710400
}
